137,7526,29926223,https://www.airbnb.com/rooms/29926223,20181115100644,2018-11-15,"Safe Handsome 2bd/2ba Loft, Steps to McCormick","Welcome to our New McCormick Loft. If you look out the window, you can see McCormick less than a 5 min walk away. Guests love our home because: -Brand-new building with simple tech for easy access -Steps away from McCormick -Comfy Queen beds (+3 extra beds for groups) -Rooftop deck -Gym -Washer/Dryer in building -Modern loft feel -Fully-stocked with essentials! Our home is perfect for business travelers/groups who want to be close to McCormick, but also want super easy access to Downtown!","Our McCormick Loft has a gorgeous layout with vaulted ceilings and stunning views of the South loop to make your stay the perfect combination of comfort and lifestyle.  Our guests enjoy apartment features including beautiful 10-12 ft lofted ceilings, plank-hardwood floors and a brand-new roof deck for community access. The fitness room comes in especially handy in the winter, complete with cross training, treadmills, and brand new weight sets. Central Heating and Cooling Contemporary Kitchens Full-bay Windows Brand-new Countertops Luxury Vinyl Tile Stainless Steel Appliances Walk-In Closets Steps away from McCormick Square ≈1 mile South of Museum Campus Easy Access to Lakefront and Grant Park Easy Access to Local Expressways Easy Access to Public Transportation Walkscore: 92 Rooftop Lounge","Welcome to our New McCormick Loft. If you look out the window, you can see McCormick less than a 5 min walk away. Guests love our home because: -Brand-new building with simple tech for easy access -Steps away from McCormick -Comfy Queen beds (+3 extra beds for groups) -Rooftop deck -Gym -Washer/Dryer in building -Modern loft feel -Fully-stocked with essentials! Our home is perfect for business travelers/groups who want to be close to McCormick, but also want super easy access to Downtown! Our McCormick Loft has a gorgeous layout with vaulted ceilings and stunning views of the South loop to make your stay the perfect combination of comfort and lifestyle.  Our guests enjoy apartment features including beautiful 10-12 ft lofted ceilings, plank-hardwood floors and a brand-new roof deck for community access. The fitness room comes in especially handy in the winter, complete with cross training, treadmills, and brand new weight sets. Central Heating and Cooling Contemporary Kitchens Full-bay",none,"The South Loop is such a dynamic mix of attractions and histories that the neighborhood tends to be seen as many different things to many different people. Consider the assorted areas that comprise the South Loop: Much of its eastern edge is encompassed by the Museum Campus, an impressive collection of cultural treasures that includes the Field Museum, Adler Planetarium and Shedd Aquarium. This campus sits on scenic lakefront parklands that are an extension of Grant Park. With 319 acres of green space and recreational fields, Grant Park is known as ""Chicago's front yard"" to locals and also plays host to major city events such as Taste of Chicago, Chicago Blues Festival and Lollapalooza.  Jutting out further into Lake Michigan is Northerly Island, a peninsula sought out by nature lovers, while along the southern edge the sports fans know Soldier Field as the stadium for the beloved Chicago Bears football team. Meeting attendees are most familiar with McCormick Place, the largest convent",,"You are only a 2 minute walk from the Green Line Subway stop, which gets you virtually everywhere in the City. You are also a short walk to a number of restaurants and attractions","With your key fob, guests have access to the suite, rooftop, gym, amenities, and washer/dryer","We are here to help, but give you space to enjoy!",,,,https://a0.muscache.com/im/pictures/d9bc6008-4dd8-4764-a1ca-95e44508af23.jpg?aki_policy=large,,98193524,https://www.airbnb.com/users/show/98193524,Jer+Team,2016-10-05,"Chicago, Illinois, United States","Howdy! My name is Jer and I love Chicago. The lake, the food, the architecture, the (Website hidden by Airbnb) much to love about Chicago and I can't wait to share it with you! 

Whether you are looking to find the local dives, the little-known coffee shops, or the best restaurants in a certain neighborhood, how can I help?",within an hour,100%,,f,https://a0.muscache.com/im/pictures/user/d05a9ef2-9b30-41df-9015-e8846ec164ae.jpg?aki_policy=profile_small,https://a0.muscache.com/im/pictures/user/d05a9ef2-9b30-41df-9015-e8846ec164ae.jpg?aki_policy=profile_x_medium,River North,5.0,5.0,"['email', 'phone', 'reviews', 'jumio', 'offline_government_id', 'kba', 'selfie', 'government_id', 'identity_manual', 'work_email']",t,f,"Chicago, IL, United States",South Loop/Printers Row,Near South Side,,Chicago,IL,60616,Chicago,"Chicago, IL",US,United States,41.8535151980068,-87.62378774212668,t,Apartment,Entire home/apt,7,2.0,2,5.0,Real Bed,"{TV,Wifi,""Air conditioning"",Kitchen,""Paid parking off premises"",Gym,Elevator,""Free street parking"",Heating,Washer,Dryer,""Smoke detector"",""Carbon monoxide detector"",""First aid kit"",Essentials,Shampoo,""Lock on bedroom door"",Hangers,""Hair dryer"",Iron,""Laptop friendly workspace"",""Self check-in"",""Smart lock"",""Hot water"",""Bed linens"",""Extra pillows and blankets"",Microwave,""Coffee maker"",Refrigerator,Dishwasher,""Dishes and silverware"",""Cooking basics"",Stove,""Patio or balcony"",""Luggage dropoff allowed"",""Long term stays allowed"",""Wide hallway clearance"",""Step-free access"",""Flat path to front door"",""Well-lit path to entrance"",""Step-free access"",""Step-free access"",""Step-free access""}",,$188.00,,,$250.00,$80.00,4,$10.00,2,1125,today,t,26,51,81,97,2018-11-15,0,,,,,,,,,,t,2631279,"{""Illinois State"","" Cook County"","" IL"","" CHICAGO""}",t,f,strict_14_with_grace_period,f,f,5,,38
48,4073,21647475,https://www.airbnb.com/rooms/21647475,20181115100644,2018-11-15,Urban Oasis on Michigan Ave,"Enjoy Chicago from this comfortable, modern 1 bedroom apartment centrally located on Michigan Ave! Steps away from Soldier Field, Museum Campus, Grant Park, The Field Museum and many more attractions Chicago has to offer.  In/out outdoor parking located 2 blocks away at ~$20-30/day is available to book on SpotHero (a super convenient parking app).",This is my personal home so you will find everything you need to make your stay conformable. My apartment is in a quiet building - the perfect place to relax after a long day of sightseeing or working!,"Enjoy Chicago from this comfortable, modern 1 bedroom apartment centrally located on Michigan Ave! Steps away from Soldier Field, Museum Campus, Grant Park, The Field Museum and many more attractions Chicago has to offer.  In/out outdoor parking located 2 blocks away at ~$20-30/day is available to book on SpotHero (a super convenient parking app). This is my personal home so you will find everything you need to make your stay conformable. My apartment is in a quiet building - the perfect place to relax after a long day of sightseeing or working! The apartment is equipped with: - Central heat - In-unit washer and dryer - High-speed internet Living room: - 42 inch TV with Netflix, and Hulu account connected through Apple TV - Hi definition sound system  - 3-seat couch  - Full body mirror - Workspace - Printer Kitchen: - Cookware - Dinnerware - Blender - Electric Kettle  - Dinning table for 4 people  Bedroom: - Queen sized bed  - Clean linens - High definition wireless speaker - Reading l",none,,,,"The apartment is equipped with: - Central heat - In-unit washer and dryer - High-speed internet Living room: - 42 inch TV with Netflix, and Hulu account connected through Apple TV - Hi definition sound system  - 3-seat couch  - Full body mirror - Workspace - Printer Kitchen: - Cookware - Dinnerware - Blender - Electric Kettle  - Dinning table for 4 people  Bedroom: - Queen sized bed  - Clean linens - High definition wireless speaker - Reading light  - Plenty of clothes hanger and closet space Bathroom:  - Fresh towels - Shampoo, conditioner, and body wash - Hair dryer","You will have the space all to yourself. I can be reached by text, Airbnb message, or phone if you need anything.","- NO SMOKING in the building, including in the unit or balcony - a $200 charge will be assessed for smoking (of ANY kind) - Please take off your shoes inside the unit, especially the bedroom!  - Quiet hours after 10pm - No parties, gatherings or unregistered guests in the unit  - Lost key charge--$50 per key; Lost fob charge--$70  - Unapproved late check out will incur a $50 fee per hour.",,,https://a0.muscache.com/im/pictures/83fd628b-5ad1-41ab-a9d0-3850aa6e8289.jpg?aki_policy=large,,23954897,https://www.airbnb.com/users/show/23954897,Sierra,2014-11-19,"Chicago, Illinois, United States","I moved to Chicago a few years back to ""go to school"" and never left!  I love how this city seems to pour itself onto the streets for every nice day from April-November, and then seems to hibernate for a few months to do it all over again.  

As a Midwesterner, I appreciate that folks here are friendly, and you can find people, culture and food from all over the planet.

I love to travel, appreciate meeting folks from all over this great big world and am grateful to be a part of the Airbnb community! ",within an hour,100%,,f,https://a0.muscache.com/im/pictures/ae8e0141-4573-4e89-b1b2-7855512e66dd.jpg?aki_policy=profile_small,https://a0.muscache.com/im/pictures/ae8e0141-4573-4e89-b1b2-7855512e66dd.jpg?aki_policy=profile_x_medium,South Loop/Printers Row,3.0,3.0,"['email', 'phone', 'reviews', 'jumio', 'offline_government_id', 'kba', 'selfie', 'government_id', 'identity_manual']",t,t,"Chicago, IL, United States",South Loop/Printers Row,Near South Side,,Chicago,IL,60616,Chicago,"Chicago, IL",US,United States,41.86568714786877,-87.62512227726054,t,Apartment,Entire home/apt,2,1.0,1,1.0,Real Bed,"{TV,Wifi,Kitchen,""Paid parking off premises"",Breakfast,Elevator,Heating,Washer,Dryer,""Smoke detector"",""Carbon monoxide detector"",Essentials,Shampoo,Hangers,""Hair dryer"",Iron,""Laptop friendly workspace"",""Self check-in"",Lockbox,""Private living room"",Bathtub,""Babysitter recommendations"",""Room-darkening shades"",""Hot water"",""Bed linens"",""Extra pillows and blankets"",Microwave,""Coffee maker"",Refrigerator,Dishwasher,""Dishes and silverware"",""Cooking basics"",Oven,Stove,""Patio or balcony"",""Long term stays allowed"",""Wide hallway clearance"",""Step-free access"",""Well-lit path to entrance"",""Step-free access"",""Accessible-height bed"",""Step-free access"",""Accessible-height toilet"",""Step-free access""}",,$150.00,,,$300.00,$40.00,2,$30.00,2,1125,2 days ago,t,15,36,66,66,2018-11-15,69,2017-11-20,2018-11-05,91.0,10.0,9.0,10.0,10.0,10.0,9.0,t,City registration pending,"{""Illinois State"","" Cook County"","" IL"","" CHICAGO""}",f,f,moderate,f,f,3,5.73,40
24,2150,15042524,https://www.airbnb.com/rooms/15042524,20181115100644,2018-11-15,Downtown Loft! 2 BR (415) - McCormick place,"My place is close to South loop, McCormick Center, the Field museum, Lake Shore drive, Soldiers Field, Roosevelt subway station, Aquarium, Planetarium, Millennial Park Waffles. You’ll love my place because of its hot area, i.e. South Loop,  modern, sleek and newly renovated style, gorgeous granite counter-tops, rustic wood floors, HUGE windows, in-unit washers and dryers, new patio and BBQ grill and phenomenal views of the city... Parking is available for $20 per day per car in a building garage","You will love our modern  two-bedroom apartment. Our sleek and newly renovated loft feature granite countertops, polished concrete or wood flooring, floor-to-ceiling windows, in-unit washers and dryers, and phenomenal views of the city.  Enjoy the convenience of a fitness center, on-site dry cleaning, a sky garden with a fire pit and BBQ grills, a dog run, a private resident park, and a wireless internet lounge. We are just steps away from restaurants, shopping, museums, Lake Michigan and the Roosevelt CTA.","My place is close to South loop, McCormick Center, the Field museum, Lake Shore drive, Soldiers Field, Roosevelt subway station, Aquarium, Planetarium, Millennial Park Waffles. You’ll love my place because of its hot area, i.e. South Loop,  modern, sleek and newly renovated style, gorgeous granite counter-tops, rustic wood floors, HUGE windows, in-unit washers and dryers, new patio and BBQ grill and phenomenal views of the city... Parking is available for $20 per day per car in a building garage You will love our modern  two-bedroom apartment. Our sleek and newly renovated loft feature granite countertops, polished concrete or wood flooring, floor-to-ceiling windows, in-unit washers and dryers, and phenomenal views of the city.  Enjoy the convenience of a fitness center, on-site dry cleaning, a sky garden with a fire pit and BBQ grills, a dog run, a private resident park, and a wireless internet lounge. We are just steps away from restaurants, shopping, museums, Lake Michigan and the R",none,"The South Loop / Downtown neighborhood is home to many famous venues, destinations, and business hubs.  The South Loop is such a dynamic mix of attractions and histories that the neighborhood tends to be seen as many different things to many different people. Consider the assorted areas that comprise the South Loop: Much of its eastern edge is encompassed by the Museum Campus, an impressive collection of cultural treasures that includes the Field Museum, Adler Planetarium and Shedd Aquarium. This campus sits on scenic lakefront parklands that are an extension of Grant Park. With 319 acres of green space and recreational fields, Grant Park is known as ""Chicago's front yard"" to locals and also plays host to major city events such as Taste of Chicago, Chicago Blues Festival and Lollapalooza.  Jutting out further into Lake Michigan is Northerly Island, a peninsula sought out by nature lovers, while along the southern edge the sports fans know Soldier Field as the stadium for the beloved Ch",Parking is available upon request please inquire for additional details,Here are a few places with exact distances in mileage from the prorperty. McCormick place - 1.6 mi 7 min drive Soldier Field - 1.3 miles 6 min drive  The Adler Planetarium - 1.5 mi 7 min drive The Shedd Aquarium - 1.6 mi 9 min drive The Field museum - 1.0 mi 5 min drive Grant Park - 1.5 mi 6 min drive The Art Institute Of Chicago - 1.3 mi 5 min drive Millenium Park - 1.4 mi 6 min drive Navy Pier - 2.7 mi 11 min drive Willis Tower (Sears Tower) - 1.4 mi 7 min drive Showplace ICON Theatre - 1.1 mi 5 min drive Magnificent Mile 2.5 mi away John Hancock Center 3 mi away Chicago River 2 mi away Millennium Park 1.6 mi away Grant Park 1.4 mi away The Illinois Institute of Art - Chicago 1.8 mi away,"As an ""Entire home"" reservation, you'll have the ENTIRE two bedroom apartment to yourselves. Enjoy the privacy and luxury of this unique experience :)",You can call me any time,No  smoking. Smoking fine is $500 Please let us know 24 hours in advance if you need Pack ’n Play/travel crib No guests are allowed in the unit during your reservation aside from those that are part of the reservation and will be staying overnight. You will be charged $50/person per night for any guests that enter the unit that are not on the reservation.,,,https://a0.muscache.com/im/pictures/35847454-eca2-47f0-98f8-c4b95fb105f3.jpg?aki_policy=large,,89737716,https://www.airbnb.com/users/show/89737716,Oleg,2016-08-13,"Chicago, Illinois, United States",I love hosting people in my beautiful place. Chicago is one of the most fascinating cities in the world and I am happy I can contribute to your experience of it. I love to travel myself and learn new languages and new cultures. ,within an hour,100%,,f,https://a0.muscache.com/im/pictures/user/914afe4c-82bd-423b-b180-a184469209eb.jpg?aki_policy=profile_small,https://a0.muscache.com/im/pictures/user/914afe4c-82bd-423b-b180-a184469209eb.jpg?aki_policy=profile_x_medium,River North,14.0,14.0,"['email', 'phone', 'google', 'reviews']",t,f,"Chicago, IL, United States",South Loop/Printers Row,Near South Side,,Chicago,IL,60605,Chicago,"Chicago, IL",US,United States,41.86459023057793,-87.62640894689443,t,Apartment,Entire home/apt,5,2.0,2,4.0,Real Bed,"{TV,""Cable TV"",Internet,Wifi,""Air conditioning"",Kitchen,""Free parking on premises"",""Paid parking off premises"",Doorman,Gym,Elevator,Heating,""Family/kid friendly"",Washer,Dryer,""Smoke detector"",""Carbon monoxide detector"",""First aid kit"",""Safety card"",""Fire extinguisher"",Essentials,Shampoo,Hangers,""Hair dryer"",Iron,""Laptop friendly workspace"",""Self check-in"",""Building staff"",Bathtub,""Stair gates"",""Children’s books and toys"",""Window guards"",""Babysitter recommendations"",""Pack ’n Play/travel crib"",""Room-darkening shades"",""Hot water"",""Bed linens"",""Extra pillows and blankets"",Microwave,""Coffee maker"",Refrigerator,Dishwasher,""Dishes and silverware"",""Cooking basics"",Stove,""BBQ grill"",""Patio or balcony"",""Long term stays allowed"",""Wide hallway clearance"",""Step-free access"",""Wide doorway"",""Flat path to front door"",""Well-lit path to entrance"",""Step-free access"",""Step-free access"",""Wide clearance to shower, toilet"",""Step-free access"",""Wide entryway"",""Paid parking on premises""}",,$129.00,,,$0.00,$69.00,2,$20.00,2,1124,today,t,5,29,47,67,2018-11-15,182,2016-09-16,2018-11-12,94.0,10.0,9.0,10.0,9.0,10.0,9.0,t,R18000030236,"{""Illinois State"","" Cook County"","" IL"","" CHICAGO""}",t,f,moderate,f,f,14,6.9,40
83,5460,25295961,https://www.airbnb.com/rooms/25295961,20181115100644,2018-11-15,**Stunning Magnificent Mile 3br Condo**,"Great location for family fun, and business travelers.",,"Great location for family fun, and business travelers.",none,,,,,,- 24/7 Quiet Hours - No shoes in the house,,,https://a0.muscache.com/im/pictures/435c1ac9-5fc3-4774-9b64-6ba1995c7ee5.jpg?aki_policy=large,,4335446,https://www.airbnb.com/users/show/4335446,Carrie,2012-12-05,"Chicago, Illinois, United States",,within an hour,100%,,f,https://a0.muscache.com/im/pictures/ab564949-9c08-4197-8c1f-c70358aa418a.jpg?aki_policy=profile_small,https://a0.muscache.com/im/pictures/ab564949-9c08-4197-8c1f-c70358aa418a.jpg?aki_policy=profile_x_medium,Streeterville,21.0,21.0,"['email', 'phone', 'google', 'reviews', 'jumio', 'government_id']",t,t,"Chicago, IL, United States",South Loop/Printers Row,Near South Side,,Chicago,IL,60605,Chicago,"Chicago, IL",US,United States,41.86521502258663,-87.62529954827063,t,Condominium,Entire home/apt,6,2.0,3,3.0,Real Bed,"{TV,Wifi,""Air conditioning"",Kitchen,Heating,""Family/kid friendly"",Washer,Dryer,""Smoke detector"",Essentials,Hangers,Iron,""Laptop friendly workspace"",""Hot water"",""Long term stays allowed"",Other,""Paid parking on premises""}",,$320.00,,,$0.00,$165.00,7,$300.00,2,28,yesterday,t,14,20,20,20,2018-11-15,3,2018-07-01,2018-09-23,80.0,8.0,8.0,9.0,10.0,10.0,8.0,t,2314688,"{""Illinois State"","" Cook County"","" IL"","" CHICAGO""}",t,f,strict_14_with_grace_period,f,f,20,0.65,41
70,4808,23635501,https://www.airbnb.com/rooms/23635501,20181115100644,2018-11-15,Segall Suite near Mccormick Place,"Watch a movie in style on the 55-inch 4K TV and sound bar within this sophisticated apartment. The modern, spacious layout with metropolitan decor includes every comfort, from the Nespresso coffee maker to the complimentary designer bath products.","Designed with the traveler in mind, this 2 Bedroom Alto Suite (sleeps 6) caters to all your needs in a modern, spacious layout with metropolitan decor that gives this suite a sophisticated edge. Set against the beautiful Chicago skyline, the Segal Suite is thriving with downtown city vibes. Alto suites offer guests a modern space with custom comforts that are a cut above the usual AirBnB experience. Each room is uniquely designed with its own stylish accents and convenient amenities to give you the perfect mixture of home and away. At the premium status level, the Alto suite provides you with a premiere experience in a premiere city. At a Glance * Custom furnishings  * Alba Botanical bath and body products * 55-inch 4K TV’s and sound bars * Fast Internet  * Amazon Dot * Nespresso coffee maker w/ Nespresso pods *In walking distance to the best bars and restaurants *Concierge services available from 9am to 10pm (central)","Watch a movie in style on the 55-inch 4K TV and sound bar within this sophisticated apartment. The modern, spacious layout with metropolitan decor includes every comfort, from the Nespresso coffee maker to the complimentary designer bath products.",none,"This apartment is located within walking distance of McCormick Place Convention Center. It's also only a short drive to all tourist attractions, including the Field Museum, Shedd Aquarium, and Chicago Bean.",,,The entire apartment is for your private use.,,"All bookings require a security deposit of $500 or more. This deposit will not be charged in advance. For security purposes, we require all guests to provide an ID verification, license, or passport before check-in.  Guests can cancel within 24 hours of booking and receive a full refund, or cancel anytime up to seven days before the start of your trip and receive a 50% refund. Trips cancelled fewer than seven days in advance are not eligible for refunds.  Check-in time is any time after 4 P.M. Check-out time is any time before 11 a.m. If an earlier check-in or a later check-out time is desired, then you can send us a request. However, this is not guaranteed. We do not allow smoking; breaking this rule will incur a $300 fine.  Our locations do not allow pets.  No parties of any kind are allowed in the unit. If a location is left in an exceptionally messy state, we will charge $50 for every extra hour of cleaning required.  Guests are not allowed to book a stay in their city of residence",,,"https://a0.muscache.com/4ea/air/v2//pictures/2a2011c9-678c-4157-b281-84fb6ed21e3e.jpg?t=r:w1200-h720-sfit,e:fjpg-c85",,175391883,https://www.airbnb.com/users/show/175391883,Cloud9,2018-02-26,"Chicago, Illinois, United States",,within an hour,100%,,f,https://a0.muscache.com/im/pictures/user/b5febb6f-7e00-479e-98cf-dae563f8f22a.jpg?aki_policy=profile_small,https://a0.muscache.com/im/pictures/user/b5febb6f-7e00-479e-98cf-dae563f8f22a.jpg?aki_policy=profile_x_medium,South Loop/Printers Row,29.0,29.0,"['email', 'phone', 'google', 'jumio', 'offline_government_id', 'selfie', 'government_id', 'identity_manual']",t,f,"Chicago, IL, United States",South Loop/Printers Row,Near South Side,,Chicago,IL,60616,Chicago,"Chicago, IL",US,United States,41.8544610083064,-87.62292740180797,t,Loft,Entire home/apt,6,2.0,2,2.0,Real Bed,"{TV,Internet,Wifi,""Air conditioning"",Kitchen,Gym,Elevator,Heating,""Family/kid friendly"",Washer,Dryer,""Smoke detector"",""Carbon monoxide detector"",Essentials,Shampoo,Hangers,""Hair dryer"",Iron,""Laptop friendly workspace"",""Self check-in"",Lockbox,""Hot water"",""Body soap"",""Bath towel"",""Toilet paper"",""Bed linens"",""Extra pillows and blankets"",""Coffee maker"",""Bedroom comforts"",""Bathroom essentials""}",,$375.00,,,$500.00,$125.00,4,$35.00,2,28,today,t,15,38,68,338,2018-11-15,5,2018-03-17,2018-11-04,96.0,10.0,10.0,9.0,10.0,9.0,9.0,t,City registration pending,"{""Illinois State"","" Cook County"","" IL"","" CHICAGO""}",t,f,strict_14_with_grace_period,f,f,18,0.61,42
