131,7347,29614026,https://www.airbnb.com/rooms/29614026,20181115100644,2018-11-15,2BR South Loop Luxury Suite No.1 by Zencity,"With quick access to McCormick Place, the Museum Campus, and The Loop, this luxury suite is ideally located for first-timers discovering this vibrant city and for regular visitors who want the easiest access to all of their favorite haunts.","This modern loft apartment features high ceilings, oversized windows, and handcrafted living spaces, making it the perfect place to unwind after a day of sightseeing. Lounge on the private outdoor terrace or head to the rooftop pool deck for a stunning view of this iconic city. This two bedroom home includes two bathrooms, an open-concept kitchen, spacious living room, and private outdoor terrace. The unit accommodates up to 5 guests with comfy Queen size beds and additional sleeping space on the living room couch. Building amenities include a rooftop pool deck, 24-hour fitness center with Peloton bikes, business center, and Pressbox dry cleaning lockers.","With quick access to McCormick Place, the Museum Campus, and The Loop, this luxury suite is ideally located for first-timers discovering this vibrant city and for regular visitors who want the easiest access to all of their favorite haunts. This modern loft apartment features high ceilings, oversized windows, and handcrafted living spaces, making it the perfect place to unwind after a day of sightseeing. Lounge on the private outdoor terrace or head to the rooftop pool deck for a stunning view of this iconic city. This two bedroom home includes two bathrooms, an open-concept kitchen, spacious living room, and private outdoor terrace. The unit accommodates up to 5 guests with comfy Queen size beds and additional sleeping space on the living room couch. Building amenities include a rooftop pool deck, 24-hour fitness center with Peloton bikes, business center, and Pressbox dry cleaning lockers. Guests will be provided the combination to the electronic lock for access to the apartment, as ",none,"South Loop Young, fast-paced, and constantly changing, the South Loop is one of Chicago’s liveliest hubs. This former warehouse district is just steps from Chinatown, The Loop, museums, and public transit.","If keys are lost or misplaced there will be a $50 charge.  Also, please note that we may need to drop in between the hours of Noon-3pm to check on supplies. If anything is not to your liking, please notify us, and we will correct the situation as soon as possible.  Please note, we are not responsible for packages if they are unable to be delivered.","Cab/Uber service is easily available in this location and is our preferred method of transportation downtown. The apartment is also within a 10-minute walk to several train lines including the Red, Green, and Orange lines.","Guests will be provided the combination to the electronic lock for access to the apartment, as well as a fob for access to building amenities including the pool, fitness center, outdoor lounge space, and business center.","We will be available throughout your stay to recommend local attractions, dining, nightlife, or any other concierge services that interest you.","1. No Late Check Out Late check out will not be tolerated without prior approval.  Guests that check out late will be charged, at minimum, for the nightly rate on the day of check out. 2. No Parties Parties or other gatherings are strictly prohibited. 3. Quiet Time After 10PM Please be considerate of neighbors and refrain from playing loud music or other excessive noise. 4. Authorized Guests Only Additional guests are not allowed without prior notice and approval. 5. No Smoking  Smoking is strictly prohibited. Evidence of smoke smell or cigarette butts on the premises may be subject to a $250 fine. 6. Respect the Space Any excessive spills, stains, or other unwarranted messes will result in an additional $50 deep clean fee on top of the cost to replace or repair damages. Please note: any violation of our house rules (1-5) will result in a minimum $250 fine. We look forward to hosting you! If you are unable to abide by house rules, please consider another listing as we reserve the right",,,https://a0.muscache.com/im/pictures/6d05a5f2-005e-4fe0-ae80-986e75d057ec.jpg?aki_policy=large,,47172572,https://www.airbnb.com/users/show/47172572,Zencity,2015-10-22,"Chicago, Illinois, United States","Modern travel means you deserve the most out of your stay – complete with amenities that matter to you. Zencity offers every guest convenient locations, kitchen essentials, and several great entertainment options for you to enjoy. All coupled with insider knowledge and access to the best the city has to offer.",within an hour,100%,,t,https://a0.muscache.com/im/pictures/user/85187965-2a2c-4561-afa3-cbc433775617.jpg?aki_policy=profile_small,https://a0.muscache.com/im/pictures/user/85187965-2a2c-4561-afa3-cbc433775617.jpg?aki_policy=profile_x_medium,Hyde Park,56.0,56.0,"['email', 'phone', 'reviews', 'jumio', 'offline_government_id', 'kba', 'selfie', 'government_id', 'identity_manual', 'work_email']",t,f,"Chicago, IL, United States",South Loop/Printers Row,Near South Side,,Chicago,IL,60616,Chicago,"Chicago, IL",US,United States,41.854677148976286,-87.62585130730963,t,Serviced apartment,Entire home/apt,5,2.0,2,1.0,Real Bed,"{TV,Wifi,""Air conditioning"",Pool,Kitchen,""Paid parking off premises"",Gym,Elevator,Heating,Washer,Dryer,""Smoke detector"",""Carbon monoxide detector"",""First aid kit"",""Safety card"",""Fire extinguisher"",Essentials,Shampoo,""Lock on bedroom door"",Hangers,""Hair dryer"",Iron,""Laptop friendly workspace"",""Self check-in"",Keypad,""Hot water"",""Bed linens"",""Extra pillows and blankets"",Microwave,""Coffee maker"",Refrigerator,Dishwasher,""Dishes and silverware"",""Cooking basics"",Oven,Stove,""Single level home"",""BBQ grill"",""Long term stays allowed""}",,$99.00,,,$0.00,$57.00,3,$50.00,2,1125,today,t,26,56,86,102,2018-11-15,0,,,,,,,,,,t,City registration pending,"{""Illinois State"","" Cook County"","" IL"","" CHICAGO""}",f,f,moderate,f,f,56,,24
117,6664,28241077,https://www.airbnb.com/rooms/28241077,20181115100644,2018-11-15,"Southloop |McCormick| King Bed| 55"" TV| Wifi","Modern beautiful 1 bedroom condo that has a balcony overlooking the Zen Garden. This apartment has everything you need for a comfortable stay. Convenient self check in / checkout! Great spot in Chicago's swanky South Loop! Minutes away from Grant & Millennium Parks, Wintrust Arena, McCormick Place, Field Museum, Shed Aquarium, and the Planetarium. My place is also close to the train station and Soldier Field if you would like to catch a Bears game while visiting.","Welcome to the beautiful city of Chi-Town! I'm ecstatic to have you as my guest and my intention is maximize your experience!! It is my pleasure to make sure you are comfortable in my home and have all your needs accommodated.  This is a modern 700 square foot fully furnished apartment with one full bath & separate shower, breakfast island and has private balcony with garden views.  Living Room: After a full day of exploring the city, relax on the cozy sectional. High definition Smart TV with ROKU which gives you access to Netflix, Pandora, Movies and more. Bedroom: Sun drench bedroom with floor to ceiling windows gives you a beautiful view of the city. Lay in bed as you watch the sun set from the bedroom. It’s a calming and serene experience! The memory foam mattress feels like you are sleeping on clouds. Plenty of down-filled pillows (4) and extra blankets. if you wish close the blinds and enjoy a lazy morning. Kitchen: Fully stocked - Pots, pans, stemware, silverware, steak knives, ","Modern beautiful 1 bedroom condo that has a balcony overlooking the Zen Garden. This apartment has everything you need for a comfortable stay. Convenient self check in / checkout! Great spot in Chicago's swanky South Loop! Minutes away from Grant & Millennium Parks, Wintrust Arena, McCormick Place, Field Museum, Shed Aquarium, and the Planetarium. My place is also close to the train station and Soldier Field if you would like to catch a Bears game while visiting. Welcome to the beautiful city of Chi-Town! I'm ecstatic to have you as my guest and my intention is maximize your experience!! It is my pleasure to make sure you are comfortable in my home and have all your needs accommodated.  This is a modern 700 square foot fully furnished apartment with one full bath & separate shower, breakfast island and has private balcony with garden views.  Living Room: After a full day of exploring the city, relax on the cozy sectional. High definition Smart TV with ROKU which gives you access to Net",none,"The South Loop is such a dynamic mix of attractions and histories that the neighborhood tends to be seen as many different things to many different people. Consider the assorted areas that comprise the South Loop: Much of its eastern edge is encompassed by the Museum Campus, an impressive collection of cultural treasures that includes the Field Museum, Adler Planetarium and Shedd Aquarium. This campus sits on scenic lakefront parklands that are an extension of Grant Park. With 319 acres of green space and recreational fields, Grant Park is known as ""Chicago's front yard"" to locals and also plays host to major city events such as Taste of Chicago, Chicago Blues Festival and Lollapalooza.  Jutting out further into Lake Michigan is Northerly Island, a peninsula sought out by nature lovers, while along the southern edge the sports fans know Soldier Field as the stadium for the beloved Chicago Bears football team. Meeting attendees are most familiar with McCormick Place, the largest convent","Restaurants: great places for breakfast, brunch, sushi, burgers, pizza and beer. Cute local bars. Only a 10-12 min cab ride from the West Loop neighborhood which offers some of the best well known restaurants and bars in Chicago with world renowed chefs. Grocery Store: Jewel, Trader Joe's and Whole foods is nearby. Giordano's & Lou Malanti's: the two best places to eat pizza in Chicago are 5 minuets away Northerly Island: 15 minute walk planetarium, aquarium, field museum and Solider  Sox Park: 15 minute train ride.  Wrigleyville : 30 minute train ride Shopping: Magnificent Mile on Michigan avenue is a 10 min bus ride/bike rise away. Major Attractions are close by: All these attractions are accessible by walking/bike ride/bus/train  The bus stop is right in front of my condo.  The red line & green line train is an 8-minute walk from the condo Millennium Park: a beautiful 20 min walk through grant park, gardens and the Art Museum Navy Pier: 15-minute bus ride, 20-minute bike ride, 30/45",Uber: Available within 1-2 minutes Train station: 3 minute walk Bus CTA: Directly outside the building Divvy Bike: 1/2 a block away,"Entire apartment, GYM, POOL and ALL Building Amenities.  *YOU DO NOT HAVE ACCESS TO THE HALLWAY CLOSET LABELED ""AQUEELAH'S CLOSET""",,- - - ABSOLUTELY NO SMOKING to avoid additional cleaning service fee if $100.    - Take your shoes off at the door and place them in the shoe tray.    - No eating on the couch or in the bedrooms.    - Please clean up any spills or accidents immediately and keep the space tidy.  - Please take your shoes off at the door and place them in the shoe cubby.   - Please clean all used dishes. You are welcome to use the dishwasher. - Quiet time Monday thru Sunday 10p-8a - Use the squeegee after ever shower - Upon departure Place all used towels and linens in the center of the bathroom floor. - Upon departure clear all trash and take it to the Trash Chute Located in the Hallway on your  floor.,,,https://a0.muscache.com/im/pictures/ffde6371-7dfc-4755-b1e7-2c19505175c1.jpg?aki_policy=large,,72670952,https://www.airbnb.com/users/show/72670952,Aqueelah,2016-05-18,"Chicago, Illinois, United States","I'm a former Network Analyst turned Yoga instructor & Investor who loves to travel and meet new people! 

My Favorites: 

Book: Untethered Soul
Bar: Aviator
Restaurant: Summer House Brunch
Vacation: Panama City, Panama
Hobbies: Personal Development, Practicing Yoga, Adding Value to Every Person I meet, Hosting, Communing in nature, trying new restaurants and traveling. 

",within an hour,100%,,t,https://a0.muscache.com/im/pictures/a0d7e208-726f-4b1e-8d7a-b80973dc47d6.jpg?aki_policy=profile_small,https://a0.muscache.com/im/pictures/a0d7e208-726f-4b1e-8d7a-b80973dc47d6.jpg?aki_policy=profile_x_medium,South Loop/Printers Row,9.0,9.0,"['email', 'phone', 'reviews', 'jumio', 'offline_government_id', 'selfie', 'government_id', 'identity_manual']",t,t,"Chicago, IL, United States",South Loop/Printers Row,Near South Side,,Chicago,IL,60616,Chicago,"Chicago, IL",US,United States,41.85461189091474,-87.62554981380121,t,Apartment,Entire home/apt,6,1.0,1,2.0,Real Bed,"{TV,""Cable TV"",Wifi,""Air conditioning"",Pool,Kitchen,Gym,Breakfast,Elevator,Heating,Washer,Dryer,""Smoke detector"",""Carbon monoxide detector"",""First aid kit"",""Safety card"",""Fire extinguisher"",Essentials,Shampoo,Hangers,""Hair dryer"",Iron,""Laptop friendly workspace"",""Self check-in"",""Smart lock"",""Private living room"",""Hot water"",""Bed linens"",""Extra pillows and blankets"",""Ethernet connection"",Microwave,""Coffee maker"",Refrigerator,Dishwasher,""Dishes and silverware"",""Cooking basics"",Oven,Stove,""BBQ grill"",""Patio or balcony"",""Garden or backyard"",""Long term stays allowed"",""Cleaning before checkout"",""Wide hallway clearance"",""Step-free access"",""Wide doorway"",""Flat path to front door"",""Well-lit path to entrance"",""Step-free access"",""Wide doorway"",""Wide clearance to bed"",""Accessible-height bed"",""Step-free access"",""Step-free access"",""Wide entryway""}",,$199.00,,,$300.00,$125.00,2,$25.00,1,26,today,t,28,58,88,178,2018-11-15,4,2018-10-06,2018-10-30,80.0,9.0,10.0,8.0,9.0,10.0,8.0,t,City registration pending,"{""Illinois State"","" Cook County"","" IL"","" CHICAGO""}",t,f,strict_14_with_grace_period,f,f,7,2.93,24
58,4601,23039257,https://www.airbnb.com/rooms/23039257,20181115100644,2018-11-15,Updated South Loop Building with FREE Parking,"Unbeatable location South Loop oasis close to McCormick place, Wintrust Arena, Green Line Train, and Lakefront. Pets welcome, and free street parking available on Cullerton. Great for large groups, business travelers, and families. Brand new fully-renovated building with beautiful exposed-brick bedrooms and updated bathrooms. Walking distance to bars, restaurants, and minutes to downtown.",,"Unbeatable location South Loop oasis close to McCormick place, Wintrust Arena, Green Line Train, and Lakefront. Pets welcome, and free street parking available on Cullerton. Great for large groups, business travelers, and families. Brand new fully-renovated building with beautiful exposed-brick bedrooms and updated bathrooms. Walking distance to bars, restaurants, and minutes to downtown. The whole apartment. The unit is located 2 blocks from the Green Line and 3 blocks from the Red Line. The train runs behind the building during the day. You can hear it slightly inside two of the bedrooms.",none,,The train runs behind the building during the day. You can hear it slightly inside two of the bedrooms.,The unit is located 2 blocks from the Green Line and 3 blocks from the Red Line.,The whole apartment.,,- No large parties/ events,,,https://a0.muscache.com/im/pictures/9942a8e9-0219-4606-9d8f-cfc1548a2eb8.jpg?aki_policy=large,,170959934,https://www.airbnb.com/users/show/170959934,Amy,2018-01-31,"Chicago, Illinois, United States",,within an hour,90%,,f,https://a0.muscache.com/im/pictures/user/cfb46587-2aaa-4d2b-b2ec-23f44ee312df.jpg?aki_policy=profile_small,https://a0.muscache.com/im/pictures/user/cfb46587-2aaa-4d2b-b2ec-23f44ee312df.jpg?aki_policy=profile_x_medium,South Loop/Printers Row,3.0,3.0,"['email', 'phone']",t,f,"Chicago, IL, United States",South Loop/Printers Row,Near South Side,,Chicago,IL,60616,Chicago,"Chicago, IL",US,United States,41.85436916565219,-87.62593441965025,t,Apartment,Entire home/apt,9,1.0,3,4.0,Real Bed,"{TV,Wifi,""Air conditioning"",Kitchen,""Free parking on premises"",""Paid parking off premises"",""Pets allowed"",Elevator,""Free street parking"",Heating,""Family/kid friendly"",Washer,Dryer,""Smoke detector"",""Carbon monoxide detector"",Essentials,Shampoo,Hangers,""Hair dryer"",Iron,""Laptop friendly workspace"",""Self check-in"",Lockbox,""Private entrance"",""Hot water"",Microwave,""Coffee maker"",Refrigerator,Dishwasher,""Dishes and silverware"",""Cooking basics"",Oven,Stove,""Long term stays allowed""}",,$165.00,,,$0.00,$80.00,1,$0.00,1,365,2 days ago,t,0,0,0,0,2018-11-15,63,2018-02-25,2018-10-28,89.0,9.0,9.0,9.0,9.0,9.0,9.0,t,City registration pending,"{""Illinois State"","" Cook County"","" IL"","" CHICAGO""}",t,f,strict_14_with_grace_period,f,f,3,7.16,25
1,81,450648,https://www.airbnb.com/rooms/450648,20181115100644,2018-11-15,Luxury Space - Come & Relax,"Steps away from McCormick Place (few minutes away), Solider Field, Magnificent Mile and all major attractions.","LOCATION! LOCATION! LOCATION! Amazing Luxury Space and Location - Step away from Everything.  Come relax and enjoy after a great day of sightseeing or working in the comfort and convenience of this great  suite.  You will enjoy a spacious luxury suite with separate living area and Kitchen.  Easy to access to McCormick and every major attraction in the Chicago land area with easy access to all city transit. Location! Location! Location! 24 hour Doorman, Free Wi-Fi throughout the condo, well equipped gym, swimming pool, game room with pool tables, corner store with beer/wine, dry-cleaners, conference rooms, all in the building with restaurant in complex steps away all for your convenience. You will have amazing views of the city, the park, the lake, Navy Pier, the Field Museum, Soldier Field, McCormick Place, even the state of Indiana on a clear day.  Located in a luxury high rise you will enjoy a private bedroom and bathroom with easy access to restaurants, nightclubs, shopping, movie t","Steps away from McCormick Place (few minutes away), Solider Field, Magnificent Mile and all major attractions. LOCATION! LOCATION! LOCATION! Amazing Luxury Space and Location - Step away from Everything.  Come relax and enjoy after a great day of sightseeing or working in the comfort and convenience of this great  suite.  You will enjoy a spacious luxury suite with separate living area and Kitchen.  Easy to access to McCormick and every major attraction in the Chicago land area with easy access to all city transit. Location! Location! Location! 24 hour Doorman, Free Wi-Fi throughout the condo, well equipped gym, swimming pool, game room with pool tables, corner store with beer/wine, dry-cleaners, conference rooms, all in the building with restaurant in complex steps away all for your convenience. You will have amazing views of the city, the park, the lake, Navy Pier, the Field Museum, Soldier Field, McCormick Place, even the state of Indiana on a clear day.  Located in a luxury high ri",none,,,,,,Caveats: 1) There is no Smoking allowed in the apartment  2) There are No Pets permitted 3) There are No additional people permitted in space 4) No illegal substance permitted 5) Parking is an additional $20 per day if needed Join us we want to be a part of your stay in Chicago!,,,https://a0.muscache.com/im/pictures/92243133/4c1ecc40_original.jpg?aki_policy=large,,2204693,https://www.airbnb.com/users/show/2204693,Dl,2012-04-23,US,"Thanks for checking out my listing and hopefully we'll get to meet you soon!
",,,,f,https://a0.muscache.com/im/pictures/17a3e97d-2261-4690-8d69-39dc5538fa06.jpg?aki_policy=profile_small,https://a0.muscache.com/im/pictures/17a3e97d-2261-4690-8d69-39dc5538fa06.jpg?aki_policy=profile_x_medium,South Loop/Printers Row,1.0,1.0,"['email', 'phone', 'reviews', 'jumio', 'government_id']",t,t,"Chicago, IL, United States",South Loop/Printers Row,Near South Side,,Chicago,IL,60616,Chicago,"Chicago, IL",US,United States,41.86614374687599,-87.62275057497992,t,Condominium,Private room,2,1.0,1,1.0,Real Bed,"{TV,""Cable TV"",Internet,Wifi,""Air conditioning"",Pool,Kitchen,Gym,Elevator,""Buzzer/wireless intercom"",Heating,""Family/kid friendly"",Washer,Dryer,""Smoke detector"",""Carbon monoxide detector"",""First aid kit"",""Fire extinguisher"",Essentials,Shampoo,""Lock on bedroom door"",""Hair dryer"",""translation missing: en.hosting_amenity_50"",""Hot water"",""Host greets you"",""Paid parking on premises""}",,$119.00,,,$200.00,$75.00,1,$35.00,3,1125,3 days ago,t,24,24,24,24,2018-11-15,38,2012-05-07,2018-06-21,94.0,9.0,10.0,10.0,10.0,10.0,9.0,t,City registration pending,"{""Illinois State"","" Cook County"","" IL"","" CHICAGO""}",f,f,strict_14_with_grace_period,t,t,1,0.48,25
