,index,id,listing_url,scrape_id,last_scraped,name,summary,space,description,experiences_offered,neighborhood_overview,notes,transit,access,interaction,house_rules,thumbnail_url,medium_url,picture_url,xl_picture_url,host_id,host_url,host_name,host_since,host_location,host_about,host_response_time,host_response_rate,host_acceptance_rate,host_is_superhost,host_thumbnail_url,host_picture_url,host_neighbourhood,host_listings_count,host_total_listings_count,host_verifications,host_has_profile_pic,host_identity_verified,street,neighbourhood,neighbourhood_cleansed,neighbourhood_group_cleansed,city,state,zipcode,market,smart_location,country_code,country,latitude,longitude,is_location_exact,property_type,room_type,accommodates,bathrooms,bedrooms,beds,bed_type,amenities,square_feet,price,weekly_price,monthly_price,security_deposit,cleaning_fee,guests_included,extra_people,minimum_nights,maximum_nights,calendar_updated,has_availability,availability_30,availability_60,availability_90,availability_365,calendar_last_scraped,number_of_reviews,first_review,last_review,review_scores_rating,review_scores_accuracy,review_scores_cleanliness,review_scores_checkin,review_scores_communication,review_scores_location,review_scores_value,requires_license,license,jurisdiction_names,instant_bookable,is_business_travel_ready,cancellation_policy,require_guest_profile_picture,require_guest_phone_verification,calculated_host_listings_count,reviews_per_month,crime_within_pt1
9,785,6794333,https://www.airbnb.com/rooms/6794333,20181115100644,2018-11-15,Cozy sailboat in urban harbor,Enjoy our cozy sailboat and enjoy the skyline views. We're moored in a quiet harbor next to Chicago's Museum Campus and Soldier Field late April thru October. Ask about our pre-season booking discount for the 2018 season!,"The boat offers a convertible main salon and two berths, a limited galley, and the deck for relaxation and lounging.  The skyline views are fantastic both day and night. The outdoor speakers will broadcast either radio or your device. The Navy Pier fireworks are in view on Wednesday and Saturday nights.","Enjoy our cozy sailboat and enjoy the skyline views. We're moored in a quiet harbor next to Chicago's Museum Campus and Soldier Field late April thru October. Ask about our pre-season booking discount for the 2018 season! The boat offers a convertible main salon and two berths, a limited galley, and the deck for relaxation and lounging.  The skyline views are fantastic both day and night. The outdoor speakers will broadcast either radio or your device. The Navy Pier fireworks are in view on Wednesday and Saturday nights. You have access to the whole boat and its adjacent dock. Feel free to store your perishables in the fridge. In addition to the on-board 'head', more traditional facilities, including showers and laundry, are a short walk away. If you have a vehicle, we have a parking pass for the lot just outside the dock. We will conduct in-person check ins and go over everything you need to know.  We're close by so feel free to call if you have any questions. We are a 10 minute walk ",none,,It is a rather high step up to get on/off board and then down into the cabin. If you're lacking agility and can't make the step up or the small jump down then this might not be the right place for your stay.  Bottled water is provided.,"We are a 10 minute walk to the Field Museum where many cabs are available, a 15-20 minute walk to south Michigan Ave for several CTA bus routes, and another block further to the 'el' trains. There are also 2-3 nearby Divvy stations where bikes are available for rent.","You have access to the whole boat and its adjacent dock. Feel free to store your perishables in the fridge. In addition to the on-board 'head', more traditional facilities, including showers and laundry, are a short walk away. If you have a vehicle, we have a parking pass for the lot just outside the dock.",We will conduct in-person check ins and go over everything you need to know.  We're close by so feel free to call if you have any questions.,"1. No smoking, no exceptions. 2. The head is delicate... Do not put anything in that you haven't eaten plus 4 squares of TP at one time. 3. The stove is not available for use. 4. Please do not entertain more than 10 people, including those in your party.",,,https://a0.muscache.com/im/pictures/a6116d0c-2245-40f7-a2ba-2f00d8e807ae.jpg?aki_policy=large,,27752204,https://www.airbnb.com/users/show/27752204,Barbara,2015-02-14,"Chicago, Illinois, United States","Sailor girl that loves travel, food, wine and people!",,,,t,https://a0.muscache.com/im/users/27752204/profile_pic/1433856880/original.jpg?aki_policy=profile_small,https://a0.muscache.com/im/users/27752204/profile_pic/1433856880/original.jpg?aki_policy=profile_x_medium,South Loop/Printers Row,1.0,1.0,"['email', 'phone', 'reviews', 'jumio', 'offline_government_id', 'kba', 'selfie', 'government_id', 'identity_manual']",t,t,"Chicago, IL, United States",South Loop/Printers Row,Near South Side,,Chicago,IL,60605,Chicago,"Chicago, IL",US,United States,41.86154085957777,-87.61317151087583,t,Boat,Entire home/apt,4,0.5,0,3.0,Real Bed,"{TV,Wifi,Breakfast,Washer,Dryer,""First aid kit"",""Fire extinguisher"",Essentials,""Hair dryer"",Iron}",,$285.00,,,$400.00,$0.00,4,$30.00,1,1125,4 months ago,t,29,59,89,179,2018-11-15,46,2015-07-04,2018-10-06,97.0,10.0,9.0,10.0,10.0,10.0,9.0,t,City registration pending,"{""Illinois State"","" Cook County"","" IL"","" CHICAGO""}",f,f,strict_14_with_grace_period,f,f,1,1.12,0
95,5835,26437193,https://www.airbnb.com/rooms/26437193,20181115100644,2018-11-15,Lake Front Home,"In the southern tip of the south loop of Chicago, a lively neighborhood half mile from McCormick Convention Center and minutes away from Downtown main attractions, parks, Soldier Field, Millennium Park, etc.  Beautiful views of Lake Michigan and the city, spacious, and sophisticated condominium for you and your family.  Uniquely situated in a quiet and beautiful part of town with tree lined streets yet, only steps away from the great activities of Chicago with wonderful restaurants.","This space is perfect for business associates attending nearby conferences, especially at the McCormick Place, as well as the newly built Marriott Hotel, etc. Also perfect for a couple or family looking for a getaway without being in the middle of the hustle and bustle of downtown, but being just close enough to enjoy all of what downtown Chicago offers.  We love our space and we hope you do too!","In the southern tip of the south loop of Chicago, a lively neighborhood half mile from McCormick Convention Center and minutes away from Downtown main attractions, parks, Soldier Field, Millennium Park, etc.  Beautiful views of Lake Michigan and the city, spacious, and sophisticated condominium for you and your family.  Uniquely situated in a quiet and beautiful part of town with tree lined streets yet, only steps away from the great activities of Chicago with wonderful restaurants. This space is perfect for business associates attending nearby conferences, especially at the McCormick Place, as well as the newly built Marriott Hotel, etc. Also perfect for a couple or family looking for a getaway without being in the middle of the hustle and bustle of downtown, but being just close enough to enjoy all of what downtown Chicago offers.  We love our space and we hope you do too! 24-hour door person will have a package for you. Send a text message or call (Phone number hidden by Airbnb) Fam",none,"Family friendly with surrounding parks.  Walk to the museums, soldier field, aquarium, and dinner.  Take the pedestrian bridge on 18th or Roosevelt to the lake front of Soldiers Stadium.","The condos are privately owned.  Family building, please be quiet and discreet.",Park in garage included then walk and Uber every where.   Close to bus stop.,24-hour door person will have a package for you.,Send a text message or call (Phone number hidden by Airbnb),- Quiet 10 pm to 6 am - No shoes beyond open foyer Don't put garbage in refuse shoot after 9 pm. -keep the keys and fob with you to get in out of all parts of the building,,,https://a0.muscache.com/im/pictures/3a785e54-fc19-491a-82cb-e61453900fd3.jpg?aki_policy=large,,198794422,https://www.airbnb.com/users/show/198794422,Twanda,2018-06-29,US,,within an hour,100%,,f,https://a0.muscache.com/im/pictures/user/5331a981-a487-47f4-a6c8-06258a6dd113.jpg?aki_policy=profile_small,https://a0.muscache.com/im/pictures/user/5331a981-a487-47f4-a6c8-06258a6dd113.jpg?aki_policy=profile_x_medium,,1.0,1.0,"['email', 'phone']",t,f,"Chicago, IL, United States",South Loop/Printers Row,Near South Side,,Chicago,IL,60616,Chicago,"Chicago, IL",US,United States,41.85908292824009,-87.61927816049584,t,Condominium,Entire home/apt,5,2.0,3,3.0,Real Bed,"{TV,Wifi,""Air conditioning"",Kitchen,""Free parking on premises"",Gym,Elevator,Heating,Washer,Dryer,""Smoke detector"",""Carbon monoxide detector"",Essentials,Shampoo,""Lock on bedroom door"",Hangers,""Hair dryer"",Iron,""Laptop friendly workspace"",""Self check-in"",""Building staff"",""Private living room"",""Hot water"",""Bed linens"",""Extra pillows and blankets"",Microwave,""Coffee maker"",Refrigerator,Dishwasher,""Dishes and silverware"",""Cooking basics"",Oven,Stove,""Patio or balcony"",""Long term stays allowed"",""Wide hallway clearance"",""Step-free access"",""Wide doorway"",""Flat path to front door"",""Well-lit path to entrance"",""Step-free access"",""Wide doorway"",""Wide clearance to bed"",""Step-free access"",""Wide entryway""}",,$300.00,,,,,1,$0.00,2,1125,2 weeks ago,t,26,56,86,86,2018-11-15,13,2018-07-11,2018-10-30,100.0,10.0,10.0,10.0,10.0,10.0,10.0,t,City registration pending,"{""Illinois State"","" Cook County"","" IL"","" CHICAGO""}",t,f,moderate,f,f,1,3.05,0
35,3118,19088359,https://www.airbnb.com/rooms/19088359,20181115100644,2018-11-15,South loop/downtown Chicago Condo,"South loop condo just mins away from downtown, grant park and soldier field. Condo is on the 14th floor so you have great views. You can also walk to a lot restaurant and shops in the area",,"South loop condo just mins away from downtown, grant park and soldier field. Condo is on the 14th floor so you have great views. You can also walk to a lot restaurant and shops in the area Doorman, internet, cable Tv",none,,,,"Doorman, internet, cable Tv",,- No using the gym - No using the clubhouse - No using the rooftop,,,https://a0.muscache.com/im/pictures/1d2105b9-e2b0-436b-8edc-7b299bbdea17.jpg?aki_policy=large,,46980307,https://www.airbnb.com/users/show/46980307,LaDonna,2015-10-19,"Chicago, Illinois, United States",,,,,f,https://a0.muscache.com/im/pictures/03f110c3-b89b-4543-a1dc-dd57d283c1a3.jpg?aki_policy=profile_small,https://a0.muscache.com/im/pictures/03f110c3-b89b-4543-a1dc-dd57d283c1a3.jpg?aki_policy=profile_x_medium,South Loop/Printers Row,1.0,1.0,"['email', 'phone', 'reviews']",t,f,"Chicago, IL, United States",South Loop/Printers Row,Near South Side,,Chicago,IL,60605,Chicago,"Chicago, IL",US,United States,41.860792731919744,-87.62007028591809,t,Condominium,Entire home/apt,2,1.5,1,1.0,Real Bed,"{TV,""Cable TV"",Wifi,""Air conditioning"",Kitchen,""Free parking on premises"",Doorman,Elevator,""Indoor fireplace"",Heating,""Smoke detector"",Essentials,""translation missing: en.hosting_amenity_49"",""translation missing: en.hosting_amenity_50"",""Ethernet connection""}",,$200.00,,,$150.00,$35.00,1,$15.00,1,7,17 months ago,t,0,0,0,0,2018-11-15,9,2017-06-04,2017-07-03,90.0,10.0,8.0,7.0,9.0,10.0,9.0,t,City registration pending,"{""Illinois State"","" Cook County"","" IL"","" CHICAGO""}",t,f,flexible,f,f,1,0.51,0
29,2712,17528120,https://www.airbnb.com/rooms/17528120,20181115100644,2018-11-15,"Adeline's Sea Moose, 68 ft luxury yacht, sleeps 6","Adeline's Sea Moose is a 68 foot luxury Chris Craft Yacht docked in Burnham Harbor, just a few steps from downtown Chicago. She comfortably hosts up to 6 guests, and is the perfect opportunity to experience summertime in Chicago!","When you sleep aboard Adeline's Sea Moose you have private access to the entire vessel. The yacht stays moored to the dock at all times, and you are welcome to come and go as you please. There are 3 state rooms (1 master with queen bed and private bath, 2 additional state rooms each with 2 twin beds and shared full bath) There is also access to crew quarters with an additional bed and bath. All bathrooms are stocked with L'Occitane en Provence products and you are greeted with a complimentary welcome aboard basket. Kitchen is stocked with fresh fruit, champagne with fresh squeezed orange juice for morning mimosas, and local intelligentsia coffee.","Adeline's Sea Moose is a 68 foot luxury Chris Craft Yacht docked in Burnham Harbor, just a few steps from downtown Chicago. She comfortably hosts up to 6 guests, and is the perfect opportunity to experience summertime in Chicago! When you sleep aboard Adeline's Sea Moose you have private access to the entire vessel. The yacht stays moored to the dock at all times, and you are welcome to come and go as you please. There are 3 state rooms (1 master with queen bed and private bath, 2 additional state rooms each with 2 twin beds and shared full bath) There is also access to crew quarters with an additional bed and bath. All bathrooms are stocked with L'Occitane en Provence products and you are greeted with a complimentary welcome aboard basket. Kitchen is stocked with fresh fruit, champagne with fresh squeezed orange juice for morning mimosas, and local intelligentsia coffee. Guests are welcome to use entire yacht, and are able to come and go as they please. If you are interested in charte",none,"Docked at Burnham Harbor and within 1 mile walking distance of Adler Planetarium, Shedd Aquarium, Field Museum, Soldier Field and Northerly Island. McCormick Place, Arie Crown Theater, Grant Park, Art Institute, Millennium Park and Navy Pier are within 2 miles.",,"We provide 1 parking pass to the Burnham Harbor parking lot...which is just 20 feet away from the dock. Of course being in downtown Chicago, public transportation is everywhere!","Guests are welcome to use entire yacht, and are able to come and go as they please. If you are interested in chartering or having an event, let us know any we would gladly share our pricing and policies.",Adeline's crew is available to help at any time during your stay.,"- Yacht remains docked at all times - Quiet Hours after 10pm - No additional guests allowed aboard - Check in/out will be confirmed the week of depending on other charters. This would need to remain flexible until confirmed. - If you are interested in chartering Adeline's Sea Moose, please let us know and we would be more than happy to send you over more information with pricing. She can comfortably host up to 40 guests during charter events.",,,https://a0.muscache.com/im/pictures/830715b6-746f-4293-b8b4-cb65155bd73e.jpg?aki_policy=large,,118859633,https://www.airbnb.com/users/show/118859633,Adeline'S Sea Moose,2017-03-02,US,,,,,f,https://a0.muscache.com/im/pictures/756da622-6f91-4b23-aa38-1337d5b65efb.jpg?aki_policy=profile_small,https://a0.muscache.com/im/pictures/756da622-6f91-4b23-aa38-1337d5b65efb.jpg?aki_policy=profile_x_medium,South Loop/Printers Row,1.0,1.0,"['email', 'phone', 'kba', 'work_email']",t,f,"Chicago, IL, United States",South Loop/Printers Row,Near South Side,,Chicago,IL,60605,Chicago,"Chicago, IL",US,United States,41.859609156652546,-87.61321475216576,t,Boat,Entire home/apt,6,3.0,3,6.0,Real Bed,"{TV,Wifi,""Air conditioning"",Kitchen,""Free parking on premises"",Breakfast,Heating,""Family/kid friendly"",""Smoke detector"",""Carbon monoxide detector"",""First aid kit"",""Safety card"",""Fire extinguisher"",Essentials,""Lock on bedroom door"",Hangers,""Laptop friendly workspace""}",,"$1,200.00",,,"$2,500.00",$150.00,1,$0.00,1,1125,8 months ago,t,0,0,0,227,2018-11-15,1,2018-04-15,2018-04-15,100.0,10.0,10.0,10.0,10.0,10.0,10.0,t,City registration pending,"{""Illinois State"","" Cook County"","" IL"","" CHICAGO""}",t,f,moderate,f,f,1,0.14,0
63,4754,23497786,https://www.airbnb.com/rooms/23497786,20181115100644,2018-11-15,Beautiful & Spacious Industrial Style Loft,"Very spacious 2 bedroom/2 bathroom condo by the lake in the highly desirable Prairie district.  12-foot ceilings, generous room sizes, a separate dining room, and a split floor plan. Open kitchen with granite and stainless appliances. Hardwood floors in the living areas and brand new carpet in the bedrooms. Gas fireplace. In-unit washer/dryer.  Large balcony with views of Soldier Field and the Lake. Convenient location near the Lake, parks, museums, transportation, restaurants, and more.",,"Very spacious 2 bedroom/2 bathroom condo by the lake in the highly desirable Prairie district.  12-foot ceilings, generous room sizes, a separate dining room, and a split floor plan. Open kitchen with granite and stainless appliances. Hardwood floors in the living areas and brand new carpet in the bedrooms. Gas fireplace. In-unit washer/dryer.  Large balcony with views of Soldier Field and the Lake. Convenient location near the Lake, parks, museums, transportation, restaurants, and more.",none,,,,,,- Please take off muddy or wet shoes at front door,,,https://a0.muscache.com/im/pictures/32763b9b-0edc-4d51-8a1b-5638a892333b.jpg?aki_policy=large,,57185025,https://www.airbnb.com/users/show/57185025,Will,2016-02-02,"Chicago, Illinois, United States",,within a day,100%,,f,https://a0.muscache.com/im/pictures/48027f2a-eddd-48fa-b5bc-9b127dafb9a3.jpg?aki_policy=profile_small,https://a0.muscache.com/im/pictures/48027f2a-eddd-48fa-b5bc-9b127dafb9a3.jpg?aki_policy=profile_x_medium,South Loop/Printers Row,1.0,1.0,"['email', 'phone', 'jumio', 'offline_government_id', 'government_id']",t,f,"Chicago, IL, United States",South Loop/Printers Row,Near South Side,,Chicago,IL,60616,Chicago,"Chicago, IL",US,United States,41.85651246921943,-87.61777828807573,t,Condominium,Entire home/apt,4,2.0,2,2.0,Real Bed,"{TV,""Cable TV"",Wifi,""Air conditioning"",Kitchen,""Free parking on premises"",""Pets allowed"",Elevator,""Indoor fireplace"",Heating,""Family/kid friendly"",Washer,Dryer,""Smoke detector"",""Carbon monoxide detector"",""First aid kit"",""Safety card"",""Fire extinguisher"",Essentials,Shampoo,""Lock on bedroom door"",Hangers,""Hair dryer"",""Laptop friendly workspace"",""Bed linens"",""Extra pillows and blankets"",Microwave,""Coffee maker"",Refrigerator,Dishwasher,""Dishes and silverware"",""Cooking basics"",Oven,Stove,""Patio or balcony""}",,$175.00,,,$200.00,$50.00,4,$50.00,1,3,3 months ago,t,5,31,61,61,2018-11-15,9,2018-03-18,2018-10-08,100.0,10.0,10.0,10.0,10.0,10.0,10.0,t,City registration pending,"{""Illinois State"","" Cook County"","" IL"","" CHICAGO""}",t,f,flexible,f,f,1,1.11,1
16,1307,10452642,https://www.airbnb.com/rooms/10452642,20181115100644,2018-11-15,Amazing Location | Stunning Views | Free Parking,"You will feel on top of the world as this luxury property truly has it all. With a 24 hour doorman, heated parking in the building, hot tub, workout and rec rooms, and views not to be beat, this property is in a beautiful and safe neighborhood in Chicago.  Be at Mccormick place in under five minutes or dash off to all Chicago has to offer from our perfectly located condo in our Luxury South Loop flat. Close to public transport and an easy cab ride to the airports, we look forward to your stay!","The name of the building is called ""The Lex"".  It is truly an all purpose residence. Nothing to do here by kick back and enjoy the luxurious accommodations!","You will feel on top of the world as this luxury property truly has it all. With a 24 hour doorman, heated parking in the building, hot tub, workout and rec rooms, and views not to be beat, this property is in a beautiful and safe neighborhood in Chicago.  Be at Mccormick place in under five minutes or dash off to all Chicago has to offer from our perfectly located condo in our Luxury South Loop flat. Close to public transport and an easy cab ride to the airports, we look forward to your stay! The name of the building is called ""The Lex"".  It is truly an all purpose residence. Nothing to do here by kick back and enjoy the luxurious accommodations! Full Access, use key fob. Please feel free to text or email if there are any questions or concerns and allow for up to an hour for a response. You will receive a detailed and helpful welcome letter via email that includes all the information you'll need right at your fingertips, as well as additional fun suggestions and helpful information ab",none,"Totally convenient! The neighborhood is very safe and within a few minutes of McCormick Place, Shed Aquarium, and Soldier Field.  There is a market that has everything on the ground level of the building and there are grills by the pool.  You don't have to leave the property for any reason if you don't want to -- everything is right at your fingertips!",,"Parking is included and transportation is a breeze, with the Cermak - Chinatown EL red line train stop nearby as well as cabs/ubers readily accessible if you prefer.","Full Access, use key fob.","Please feel free to text or email if there are any questions or concerns and allow for up to an hour for a response. You will receive a detailed and helpful welcome letter via email that includes all the information you'll need right at your fingertips, as well as additional fun suggestions and helpful information about Chicago and the neighborhood.","THERE IS ABSOLUTELY NO SMOKING PERMITTED IN THE APARTMENT. There is a smoking area outside by the pool with seating. IF SMOKING OCCURS DURING YOUR STAY, A SMOKING FEE WILL BE ASSESSED.   Please leave dirty sheets and towels in and near the washing machine.  Even though it is not a requirement it would be nice if dishes were left clean.  Lastly other than what has been mentioned, leave home in the same condition as when you arrived. Cheers!",,,https://a0.muscache.com/im/pictures/bdaaf916-2cfa-4179-acd4-30c2db4fa025.jpg?aki_policy=large,,25871759,https://www.airbnb.com/users/show/25871759,Amanda,2015-01-10,"Chicago, Illinois, United States","Hi All,

I am an outgoing IT Professional and Boutiue owner that LOVES Airbnb! I have a great appreciation for travels and sports. I am certain that you and your company will have a memorable experience at my property. ",within an hour,90%,,f,https://a0.muscache.com/im/pictures/3c14ada4-e6bf-478c-931d-bd5f1f95f5f5.jpg?aki_policy=profile_small,https://a0.muscache.com/im/pictures/3c14ada4-e6bf-478c-931d-bd5f1f95f5f5.jpg?aki_policy=profile_x_medium,,1.0,1.0,"['email', 'phone', 'reviews', 'jumio', 'government_id', 'work_email']",t,t,"Chicago, IL, United States",,Near South Side,,Chicago,IL,60616,Chicago,"Chicago, IL",US,United States,41.847819860208176,-87.62833940602457,f,Apartment,Entire home/apt,4,1.0,1,2.0,Real Bed,"{TV,""Cable TV"",Internet,Wifi,""Air conditioning"",""Wheelchair accessible"",Pool,Kitchen,""Free parking on premises"",Doorman,Gym,Elevator,""Hot tub"",Heating,""Family/kid friendly"",Washer,Dryer,""Smoke detector"",""Carbon monoxide detector"",""Fire extinguisher"",Essentials,Shampoo,""24-hour check-in"",Hangers,""Hair dryer"",Iron,""Laptop friendly workspace"",""Hot water"",Other}",,$190.00,,,,$50.00,4,$35.00,2,1125,today,t,19,40,70,160,2018-11-15,86,2016-01-25,2018-10-30,97.0,10.0,9.0,10.0,10.0,10.0,10.0,t,R18000030249,"{""Illinois State"","" Cook County"","" IL"","" CHICAGO""}",t,f,moderate,f,f,1,2.51,1
