90,5630,25875253,https://www.airbnb.com/rooms/25875253,20181115100644,2018-11-15,DOWNTOWN; WALK TO EVERYTHING:  LUXURY 2-BED CONDO,"BEST VALUE & LOCATION:  -Walking Distance to Everything -Downtown South Loop Luxury high rise unit. -Free indoor private parking space. -2 beds (1 queen and 1 double), 2 CableTV's, Free WiFi, all cookware, dining needs, granite & stainless steel kitchen.   -Washer/dryer in unit. Fresh Linens and Bedding","-Space available for 3 adults (or) 2 adults and 2 small children.     1 queen bed in bedroom & 1 full sized sofa bed in living room. Walking distance to: -Soldier Field for concerts and games -McCormack Place for conventions,  -Grant Park, Millennium Park, Lake Michigan, Chicago River Boat-Taxi, Downtown -Restaurants, Grocery & Coffee Shops including Starbucks!!!  -Red Line Subway  access to Midway Airport-Transfer to O'Hare. Short Uber/Lyft ride to United Center, UIC, University of Chicago, Navy Pier. On Red Line Subway,  to all Chicago Offers.","BEST VALUE & LOCATION:  -Walking Distance to Everything -Downtown South Loop Luxury high rise unit. -Free indoor private parking space. -2 beds (1 queen and 1 double), 2 CableTV's, Free WiFi, all cookware, dining needs, granite & stainless steel kitchen.   -Washer/dryer in unit. Fresh Linens and Bedding -Space available for 3 adults (or) 2 adults and 2 small children.     1 queen bed in bedroom & 1 full sized sofa bed in living room. Walking distance to: -Soldier Field for concerts and games -McCormack Place for conventions,  -Grant Park, Millennium Park, Lake Michigan, Chicago River Boat-Taxi, Downtown -Restaurants, Grocery & Coffee Shops including Starbucks!!!  -Red Line Subway  access to Midway Airport-Transfer to O'Hare. Short Uber/Lyft ride to United Center, UIC, University of Chicago, Navy Pier. On Red Line Subway,  to all Chicago Offers. Entire Unit - Private Stay. Meet & Greet at Check-in. Passport or State ID copy required at check-in. Your host will meet and greet.  I do not ",none,"Walking distance to Soldier Field, McCormack Place, Grant Park, Lake Michigan, Downtown, Restaurants, Grocery & Coffee Shops.  including Starbucks!!!",Parking Fob Replacement Fee if lost: $100 Key Set Replacement if lost : $100,"Buses, Subway, Metra nearby; also Uber & Lyft.",Entire Unit - Private Stay. Meet & Greet at Check-in. Passport or State ID copy required at check-in.,Your host will meet and greet.  I do not live in the unit but available by cell; I'm very responsive.,-Direct all questions to your host. I am very responsive. -Please be respectful of all condo property and neighbors to earn a positive rating on AirBNB. -State ID’s or Passport of all occupants at check-in.,,,https://a0.muscache.com/im/pictures/cd21236c-9e84-4a42-9a46-de81354c9c62.jpg?aki_policy=large,,83914001,https://www.airbnb.com/users/show/83914001,Andrew,2016-07-15,"Chicago, Illinois, United States",Clean cut professional.,within an hour,100%,,f,https://a0.muscache.com/im/pictures/user/815f6db9-9590-4bed-add0-b957be91f9d0.jpg?aki_policy=profile_small,https://a0.muscache.com/im/pictures/user/815f6db9-9590-4bed-add0-b957be91f9d0.jpg?aki_policy=profile_x_medium,Rogers Park,2.0,2.0,"['email', 'phone', 'jumio', 'offline_government_id', 'selfie', 'government_id', 'identity_manual']",t,f,"Chicago, IL, United States",South Loop/Printers Row,Near South Side,,Chicago,IL,60616,Chicago,"Chicago, IL",US,United States,41.85876676867208,-87.62215255543684,t,Condominium,Entire home/apt,2,1.0,1,2.0,Real Bed,"{TV,""Cable TV"",Wifi,""Air conditioning"",Kitchen,""Free parking on premises"",Elevator,Heating,Washer,Dryer,""Smoke detector"",""Carbon monoxide detector"",""Safety card"",Essentials,Shampoo,Hangers,""Hair dryer"",Iron,""Laptop friendly workspace"",""Private living room"",""Private entrance"",Bathtub,""Hot water"",""Bed linens"",""Extra pillows and blankets"",Microwave,""Coffee maker"",Refrigerator,Dishwasher,""Dishes and silverware"",""Cooking basics"",Oven,Stove,""Single level home"",""Patio or balcony"",""Luggage dropoff allowed"",""Well-lit path to entrance"",""Host greets you"",""Lake access""}",,$199.00,,,$0.00,$25.00,2,$50.00,1,3,3 weeks ago,t,13,33,63,69,2018-11-15,21,2018-06-24,2018-11-11,99.0,10.0,10.0,10.0,10.0,10.0,10.0,t,City registration pending,"{""Illinois State"","" Cook County"","" IL"","" CHICAGO""}",t,f,strict_14_with_grace_period,f,f,2,4.34,11
36,3189,19316227,https://www.airbnb.com/rooms/19316227,20181115100644,2018-11-15,#2Bed Penthouse/Free Parking/SunsetViews/McCormick,"Modern beautiful 2 bed/2 full bath condo that comes with Free Parking and has Amazing city views. The apartment has everything you need for a comfortable stay. Convenient self check in / checkout! Great spot in Chicago's swanky South Loop! Minutes away from Grant & Millennium Parks, Wintrust Arena, McCormick Place, Field Museum, Shed Aquarium, and the Planetarium. My place is also close to the train station and Soldier Field if you would like to catch a Bears game while visiting.","Welcome to the beautiful city of Chi-Town! I'm ecstatic to have you as my guest and my intention is maximize your experience!! It is my pleasure to make sure you are comfortable in my home and have all your needs accommodated.  This is a modern 1200 square foot fully furnished condo with two full baths, breakfast island and has breath-taking city views.  Living Room: After a full day of exploring the city, relax on the cozy sectional. High definition Smart TV with Amazon FireTV Stick which gives you access to Netflix, Pandora, Movies and more. Bedroom: Sun drench bedroom with floor to ceiling windows gives you a beautiful view of the city. Lay in bed as you watch the sun set from the bedroom. It’s a calming and serene experience! The memory foam mattress feels like you are sleeping on clouds. Plenty of down-filled pillows (4) and extra blankets. if you wish close the blinds and enjoy a lazy morning. Kitchen: Fully stocked - Pots, pans, stemware, silverware, steak knives, cooking utensi","Modern beautiful 2 bed/2 full bath condo that comes with Free Parking and has Amazing city views. The apartment has everything you need for a comfortable stay. Convenient self check in / checkout! Great spot in Chicago's swanky South Loop! Minutes away from Grant & Millennium Parks, Wintrust Arena, McCormick Place, Field Museum, Shed Aquarium, and the Planetarium. My place is also close to the train station and Soldier Field if you would like to catch a Bears game while visiting. Welcome to the beautiful city of Chi-Town! I'm ecstatic to have you as my guest and my intention is maximize your experience!! It is my pleasure to make sure you are comfortable in my home and have all your needs accommodated.  This is a modern 1200 square foot fully furnished condo with two full baths, breakfast island and has breath-taking city views.  Living Room: After a full day of exploring the city, relax on the cozy sectional. High definition Smart TV with Amazon FireTV Stick which gives you access to ",none,"The South Loop is such a dynamic mix of attractions and histories that the neighborhood tends to be seen as many different things to many different people. Consider the assorted areas that comprise the South Loop: Much of its eastern edge is encompassed by the Museum Campus, an impressive collection of cultural treasures that includes the Field Museum, Adler Planetarium and Shedd Aquarium. This campus sits on scenic lakefront parklands that are an extension of Grant Park. With 319 acres of green space and recreational fields, Grant Park is known as ""Chicago's front yard"" to locals and also plays host to major city events such as Taste of Chicago, Chicago Blues Festival and Lollapalooza.  Jutting out further into Lake Michigan is Northerly Island, a peninsula sought out by nature lovers, while along the southern edge the sports fans know Soldier Field as the stadium for the beloved Chicago Bears football team. Meeting attendees are most familiar with McCormick Place, the largest convent","Restaurants: great places for breakfast, brunch, sushi, burgers, pizza and beer. Cute local bars. Only a 10-12 min cab ride from the West Loop neighborhood which offers some of the best well known restaurants and bars in Chicago with world renowed chefs. Grocery Store: Jewel, Trader Joe's and Whole foods is nearby. Giordano's & Lou Malanti's: the two best places to eat pizza in Chicago are 5 minuets away Northerly Island: 15 minute walk planetarium, aquarium, field museum and Solider  Sox Park: 15 minute train ride.  Wrigleyville : 30 minute train ride Shopping: Magnificent Mile on Michigan avenue is a 10 min bus ride/bike rise away. Major Attractions are close by: All these attractions are accessible by walking/bike ride/bus/train  The bus stop is right in front of my condo.  The red line & green line train is an 8-minute walk from the condo Millennium Park: a beautiful 20 min walk through grant park, gardens and the Art Museum Navy Pier: 15-minute bus ride, 20-minute bike ride, 30/45",Uber: Available within 1-2 minutes Train station: 3 minute walk Bus CTA: Directly outside the building Divvy Bike: 1/2 a block away,"You have access to the entire apartment except the hallway closet labeled ""Aqueelah's Closet""",,- - - ABSOLUTELY NO SMOKING to avoid additional cleaning service fee if $100.    - Take your shoes off at the door and place them in the shoe tray.    - No eating on the couch or in the bedrooms.    - Please clean up any spills or accidents immediately and keep the space tidy.  - Please take your shoes off at the door and place them in the shoe cubby.   - Please clean all used dishes. You are welcome to use the dishwasher. - Quiet time Monday thru Sunday 10p-8a - Use the squeegee after ever shower - Upon departure Place all used towels and linens in the center of the bathroom floor. - Upon departure clear all trash and take it to the Trash Chute Located in the Hallway on your  floor.,,,https://a0.muscache.com/im/pictures/f2d85d52-98fc-4a98-bf7a-3c137db3de59.jpg?aki_policy=large,,72670952,https://www.airbnb.com/users/show/72670952,Aqueelah,2016-05-18,"Chicago, Illinois, United States","I'm a former Network Analyst turned Yoga instructor & Investor who loves to travel and meet new people! 

My Favorites: 

Book: Untethered Soul
Bar: Aviator
Restaurant: Summer House Brunch
Vacation: Panama City, Panama
Hobbies: Personal Development, Practicing Yoga, Adding Value to Every Person I meet, Hosting, Communing in nature, trying new restaurants and traveling. 

",within an hour,100%,,t,https://a0.muscache.com/im/pictures/a0d7e208-726f-4b1e-8d7a-b80973dc47d6.jpg?aki_policy=profile_small,https://a0.muscache.com/im/pictures/a0d7e208-726f-4b1e-8d7a-b80973dc47d6.jpg?aki_policy=profile_x_medium,South Loop/Printers Row,9.0,9.0,"['email', 'phone', 'reviews', 'jumio', 'offline_government_id', 'selfie', 'government_id', 'identity_manual']",t,t,"Chicago, IL, United States",South Loop/Printers Row,Near South Side,,Chicago,IL,60616,Chicago,"Chicago, IL",US,United States,41.85629749518672,-87.62437381377565,t,Condominium,Entire home/apt,4,2.0,2,2.0,Real Bed,"{TV,""Cable TV"",Wifi,""Air conditioning"",Kitchen,""Free parking on premises"",Elevator,""Indoor fireplace"",Heating,Washer,Dryer,""Smoke detector"",""Carbon monoxide detector"",""First aid kit"",""Fire extinguisher"",Essentials,Shampoo,""Lock on bedroom door"",Hangers,""Hair dryer"",Iron,""Laptop friendly workspace"",""translation missing: en.hosting_amenity_49"",""translation missing: en.hosting_amenity_50"",""Self check-in"",Keypad,""Hot water"",Microwave,""Coffee maker"",Refrigerator,Dishwasher,""Dishes and silverware"",""Cooking basics"",Oven,Stove,""Luggage dropoff allowed"",""Long term stays allowed"",""Step-free access"",""Wide doorway"",""Flat path to front door"",""Well-lit path to entrance"",""Step-free access"",""Step-free access"",""Lake access"",Beachfront}",,$329.00,,,$300.00,$115.00,4,$45.00,2,35,today,t,24,47,74,158,2018-11-15,37,2017-08-20,2018-10-17,98.0,10.0,10.0,10.0,10.0,10.0,9.0,t,R17000022195,"{""Illinois State"","" Cook County"","" IL"","" CHICAGO""}",t,f,strict_14_with_grace_period,f,f,7,2.45,11
19,1767,13505037,https://www.airbnb.com/rooms/13505037,20181115100644,2018-11-15,South Loop/McCormick Entire Apt 1br,"Amazing one bedroom in the South Loop, near downtown. Convenient and close to major attractions, restaurants, and easy access to public transportation. 650 SF Apt. Sleeps 2 - Full Size Bed in Bedroom and Full Size Futon Bed in living room.","This place is great for all travelers – from business to leisure. Enjoy the great location in the South Loop Downtown Chicago! Very close to McCormick Place, Chinatown, Lake Michigan, Soldier Field, Museums, Bus, and Trains. The apartment is loft style and very quiet. The location has easy access to public transportation. The one bedroom condo comes fully furnished to meet your needs. You will have access to Free Wifi, Cable TV, Full Kitchen, Laundry Washer and Dryer, Large Closet.  You will find this place to be very comfortable with a full-size bed in a one bedroom. There is plenty of closet space available to meet your needs. The laundry and dryer included provides you with fresh and clean clothes at convenience. A fully equipped kitchen includes pots, plans, teakettle, and utensils. The TV also comes with HDMI to connect your laptop.  Access to the unit is easy but also secure.  For strangers to a new city, I am certainly open to give you ideas and insights on where to go, what to ","Amazing one bedroom in the South Loop, near downtown. Convenient and close to major attractions, restaurants, and easy access to public transportation. 650 SF Apt. Sleeps 2 - Full Size Bed in Bedroom and Full Size Futon Bed in living room. This place is great for all travelers – from business to leisure. Enjoy the great location in the South Loop Downtown Chicago! Very close to McCormick Place, Chinatown, Lake Michigan, Soldier Field, Museums, Bus, and Trains. The apartment is loft style and very quiet. The location has easy access to public transportation. The one bedroom condo comes fully furnished to meet your needs. You will have access to Free Wifi, Cable TV, Full Kitchen, Laundry Washer and Dryer, Large Closet.  You will find this place to be very comfortable with a full-size bed in a one bedroom. There is plenty of closet space available to meet your needs. The laundry and dryer included provides you with fresh and clean clothes at convenience. A fully equipped kitchen includes ",none,"This is a very safe and convenient location CTA is close by with access to the “L” station. Red Line, Green Line.  Bus access to virtually anywhere downtown, navy pier, McCormick Place. Walking distance to McCormick Place, Chinatown. Bike sharing station available nearby.",,,"You will have access to WIFI, TV/Cable, a full kitchen, washer and dryer.","Depending on how busy I am with work, I may be available to show you the city. I am always open to give you advice on how to get the most out of Chicago having lived here for such a long time.","- Do NOT throw anything off the balcony, fine could be up to $500 by the city of Chicago (I cannot help you here) - No pets allowed - Controlled noise level as not to disturb neighbors - You will be fined an additional $100 per disturbance call from the building management. - If you spill and damage anything, please let me know right away. This way I can take care of it so it does not become a bigger problem.  - No smoking inside, please do so on balcony with doors closed or outside of the building. Do not throw any waste on or off the balcony (Including cigarette butts!) - Extra unreported guests will be charged at full price of the daily rate - Late checkout without notifying the host will be charged the full daily rate of the next day",,,https://a0.muscache.com/im/pictures/c88c6179-94dd-49c1-86fe-16c264f69c9e.jpg?aki_policy=large,,71097049,https://www.airbnb.com/users/show/71097049,Michael,2016-05-09,"Chicago, Illinois, United States","I lived in Europe for 6 months and have traveled extensively there. Also a frequent traveler of Asia!
I am a Chicago native so am very familiar with the city. I have been helping a friend host on Airbnb for almost two years and now I finally have the opportunity to host on my own place!",within an hour,100%,,t,https://a0.muscache.com/im/pictures/01e43100-7b30-4e3a-9034-5def9f6c2b84.jpg?aki_policy=profile_small,https://a0.muscache.com/im/pictures/01e43100-7b30-4e3a-9034-5def9f6c2b84.jpg?aki_policy=profile_x_medium,South Loop/Printers Row,1.0,1.0,"['email', 'phone', 'reviews']",t,f,"Chicago, IL, United States",South Loop/Printers Row,Near South Side,,Chicago,IL,60616,Chicago,"Chicago, IL",US,United States,41.86061401285605,-87.62267201918492,t,Loft,Entire home/apt,2,1.0,1,2.0,Real Bed,"{TV,""Cable TV"",Internet,Wifi,""Air conditioning"",Kitchen,""Paid parking off premises"",Elevator,Heating,""Family/kid friendly"",Washer,Dryer,""Smoke detector"",""Carbon monoxide detector"",""First aid kit"",""Safety card"",Essentials,Shampoo,""24-hour check-in"",Hangers,""Hair dryer"",Iron,""Laptop friendly workspace"",""Host greets you""}",,$75.00,,,$149.00,$49.00,2,$39.00,4,1125,4 weeks ago,t,22,52,82,119,2018-11-15,41,2016-07-10,2018-10-30,97.0,10.0,10.0,10.0,10.0,10.0,9.0,t,R18000024403,"{""Illinois State"","" Cook County"","" IL"","" CHICAGO""}",f,f,strict_14_with_grace_period,f,f,1,1.43,12
99,5984,26815108,https://www.airbnb.com/rooms/26815108,20181115100644,2018-11-15,"7 min downtown,  2 car garage, modern Townhouse","Great modern town house at your command with three bedrooms, three bathrooms, full kitchen, two car garage. The town house has three floors (see description below). Cross the  street from McCormick place, WALK TO METRA STATION across the street, or drive down town in 7 minutes.  Chinatown is within 5 min minutes drive or 15 minutes walk.  Stay at our beloved home and enjoy the windy city.  We welcome all traveler to share traveling experiences!","Description: Three floors First floor: one bedroom with two single beds, one bath room; walk into garage Second floor: kitchen and living room with one sofa bed sleeps one adult. Third floor:  Bedroom 1: Full bed + toddler bed with master Bathroom bedroom 2: Full bed and a toddler bed, separate bathroom in the hall way  Family friendly: Welcome to use the toys for your children in toy bin on s fond floor. We can also provide an infant bed (pack and play) if needed.   Spare strollers for international travelers with children.  We got you covered with  umbrella for rainy days. Walk three minutes to self service bike rental stations.  For your peace of mind, there is home security in place too.","Great modern town house at your command with three bedrooms, three bathrooms, full kitchen, two car garage. The town house has three floors (see description below). Cross the  street from McCormick place, WALK TO METRA STATION across the street, or drive down town in 7 minutes.  Chinatown is within 5 min minutes drive or 15 minutes walk.  Stay at our beloved home and enjoy the windy city.  We welcome all traveler to share traveling experiences! Description: Three floors First floor: one bedroom with two single beds, one bath room; walk into garage Second floor: kitchen and living room with one sofa bed sleeps one adult. Third floor:  Bedroom 1: Full bed + toddler bed with master Bathroom bedroom 2: Full bed and a toddler bed, separate bathroom in the hall way  Family friendly: Welcome to use the toys for your children in toy bin on s fond floor. We can also provide an infant bed (pack and play) if needed.   Spare strollers for international travelers with children.  We got you covered ",none,"Across street from Maccormick Place, walking distance to DePaul Arena",,"Walking to metra station at Maccormick's, Uber downtown, or 7 min by car via Michigan Ave.",Entire three floors EXCEPT the attic,"We are available for your comfort. If there is anything you ever need, call or text us at anytime! (Phone number hidden by Airbnb)","- No smoking, no parties - please take off shoes by the front door - please leave the house the way you found it",,,https://a0.muscache.com/im/pictures/dccf789e-99c9-40f1-9b45-5d76919e17a2.jpg?aki_policy=large,,105861427,https://www.airbnb.com/users/show/105861427,Paroma,2016-12-01,"Ann Arbor, Michigan, United States","We welcome diverse experiences and cherish all the good things that life brings: new experiences, new friends, new local foods...
As a family, we like to travel. It's such a great experience Airbnb offer that one can live at a home in a different world for period of time. Our favorite vacation spots include London, Paris, LA...
In fact, we love everywhere we go. ",within an hour,100%,,f,https://a0.muscache.com/im/pictures/user/c0da9504-b5f9-4aa1-8928-284f910f72df.jpg?aki_policy=profile_small,https://a0.muscache.com/im/pictures/user/c0da9504-b5f9-4aa1-8928-284f910f72df.jpg?aki_policy=profile_x_medium,South Loop/Printers Row,1.0,1.0,"['email', 'phone', 'reviews', 'jumio', 'offline_government_id', 'selfie', 'government_id', 'identity_manual']",t,f,"Chicago, IL, United States",South Loop/Printers Row,Near South Side,,Chicago,IL,60616,Chicago,"Chicago, IL",US,United States,41.846323489168064,-87.6184492428421,t,Townhouse,Entire home/apt,7,3.0,3,5.0,Real Bed,"{TV,Wifi,""Air conditioning"",Kitchen,""Free parking on premises"",Heating,Washer,Dryer,""Smoke detector"",""Carbon monoxide detector"",""Fire extinguisher"",Essentials,Shampoo,Hangers,""Hair dryer"",Iron,""Laptop friendly workspace"",""Private living room"",""Private entrance"",Bathtub,""High chair"",""Children’s books and toys"",Crib,""Pack ’n Play/travel crib"",""Room-darkening shades"",""Hot water"",""Bed linens"",""Extra pillows and blankets"",Microwave,""Coffee maker"",Refrigerator,Dishwasher,""Dishes and silverware"",""Cooking basics"",Oven,Stove,""Patio or balcony"",""Host greets you""}",,$200.00,,,$0.00,$0.00,7,$200.00,3,1125,yesterday,t,22,45,75,328,2018-11-15,7,2018-09-04,2018-11-13,100.0,10.0,10.0,10.0,10.0,10.0,10.0,t,City registration pending,"{""Illinois State"","" Cook County"","" IL"","" CHICAGO""}",t,f,flexible,f,f,1,2.88,12
